{
  "schema_version": "2.0",
  "title": "Audit of a local wicking--evaporation model for saturated pool-boiling CHF on micropillar arrays",
  "decision_or_claim": "Audit whether the local continuity extension removes the global-model dry-spot singularity and identify the evidence and closure conditions required before using the model for geometry optimization.",
  "model_status": "derived",
  "claim_ladder_rung": 4,
  "evidence_state": "derived",
  "event_definition": "CHF is represented as the limiting heat flux at which the model's vapor-bubble footprint has a vanishing central dry spot or reaches the declared evaporation-limited saturation closure. This is not an independently measured CHF event definition.",
  "system_boundary": "Liquid in a homogenized micropillar layer from the nominal bubble edge to the central dry spot, with meniscus evaporation as a distributed volume sink. The external pool, vapor bubble, and heated solid provide boundary/closure conditions rather than resolved domains.",
  "regime": {"description": "Quasi-steady, saturated, gravity-dominated pool boiling under one axisymmetric nominal bubble on a laterally homogeneous, isotropic pillar array.", "included": ["Darcy radial liquid transport", "uniform footprint-normalized meniscus evaporation", "capillary pressure", "effective permeability", "saturation properties"], "excluded": ["subcooling", "imposed flow", "bubble coalescence or percolation", "finite-heater stability", "transient dry-spot dynamics", "resolved meniscus topology"]},
  "geometry_and_frame": "Stationary laboratory frame with r positive from the bubble center to the bubble edge. Darcy velocity is positive outward; capillary-fed liquid velocity is negative. Diameters db and ddry define the outer and inner radial boundaries.",
  "materials_or_fluids": ["Pure water at a declared saturation state for illustrative calculations", "silicon or another explicitly characterized micropillar substrate"],
  "operating_conditions": [{"name": "saturation pressure", "range": "0.1 MPa illustrative case; pressure-specific calculations require archived property queries", "unit": "Pa", "property_state": "saturation", "evidence_state": "illustrative"}, {"name": "wall superheat", "range": "25 illustrative value in legacy comparison", "unit": "K", "property_state": "wall-to-saturation", "evidence_state": "assumed"}],
  "initial_conditions": ["No transient initial condition is represented; quasi-steady balance is assumed."],
  "boundary_conditions": ["P(db/2)=Psat", "P(ddry/2)=Psat-Pc for a positive dry spot", "Phi_w(ddry/2)=0 in the local-balance solution"],
  "dependent_variables": [{"name": "scaled dry-spot diameter", "symbol": "x=ddry/db", "dimension": "dimensionless", "unit": "1", "sign_convention": "0<=x<=1", "role": "local-balance solution", "property_state": "not applicable", "definition": "Central dry-spot diameter divided by nominal bubble diameter.", "evidence_state": "derived"}, {"name": "structure-induced CHF enhancement", "symbol": "q''CHF,s", "dimension": "M T^-3", "unit": "W m^-2", "sign_convention": "positive from heater to fluid", "role": "model response", "property_state": "saturation", "definition": "rho_l h_fg phi_e,ch (1-x^2).", "evidence_state": "derived"}],
  "governing_variables": [{"name": "radial Darcy velocity", "symbol": "u_r", "dimension": "L T^-1", "unit": "m s^-1", "sign_convention": "positive outward", "role": "state", "property_state": "liquid saturation properties", "definition": "Depth-averaged liquid velocity in the pillar layer.", "evidence_state": "derived"}, {"name": "effective evaporation flux", "symbol": "j_e", "dimension": "L T^-1", "unit": "m s^-1", "sign_convention": "positive liquid-to-vapor", "role": "distributed sink closure", "property_state": "meniscus at declared superheat", "definition": "Footprint-normalized volumetric evaporation flux; thermal flux is rho_l h_fg j_e.", "evidence_state": "assumed"}],
  "conservation_laws": ["Steady liquid-volume conservation in an annular control volume", "Darcy momentum closure", "Latent-energy conversion used only after the mass balance"],
  "source_and_sink_terms": ["Distributed evaporation sink 2 j_e/H in the depth-averaged continuity equation", "Capillary-pressure boundary difference Pc"],
  "constitutive_closures": [{"id": "C1", "name": "Darcy transport", "relation": "dP/dr=-(mu/K)u_r", "status": "assumed", "provenance": "Local working manuscript and prior coupled model", "calibration_boundary": "K must be independently reported or computed from a declared geometry correlation", "evidence_state": "assumed"}, {"id": "C2", "name": "Uniform effective evaporation", "relation": "j_e is spatially uniform beneath the bubble", "status": "assumed", "provenance": "Meniscus evaporation closure", "calibration_boundary": "No literature CHF target may set j_e without disclosure", "evidence_state": "assumed"}, {"id": "C3", "name": "Bubble diameter convention", "relation": "db=pi sqrt(sigma/[g(rho_l-rho_v)])", "status": "assumed", "provenance": "Rayleigh--Taylor neutral-wavelength convention in the working model", "calibration_boundary": "Do not refit db to CHF data", "evidence_state": "reported"}],
  "frame_and_invariance": "The model is a stationary, gravity-aligned, axisymmetric Darcy reduction. Galilean invariance is not claimed under imposed flow because imposed flow is excluded.",
  "scale_analysis": {"reference_scales": ["length db", "velocity j_e", "pressure Pc", "pillar height H"], "dimensionless_groups": ["x=ddry/db", "R=phi_w,ch/phi_e,ch=8PcKH/(mu j_e db^2)"], "ordering_parameters": ["feature size divided by db", "quasi-steady liquid-storage ratio", "spatial variation of j_e divided by its mean"], "expected_reduction_error": "Unquantified until local evaporation, permeability, and bubble-scale observations are available."},
  "assumptions": ["Single nominal bubble", "homogeneous laterally isotropic array", "uniform effective evaporation", "saturated boiling", "positive capillary pressure", "Static contact angle is used only in the declared flat-CHF correlation and receding contact angle only in the declared evaporation closure", "Intrinsic and apparent contact-angle inputs are not interchangeable without a source-specific sensitivity analysis"],
  "exclusions": ["Predictive CHF validation", "unmeasured contact-angle transfer across coatings", "global optimization claims outside closure range"],
  "baselines": ["Hu, Weibel, and Garimella (2019) global wicking--evaporation model", "Classical hydrodynamic CHF scaling for the flat-surface contribution"],
  "calibration_boundary": "No experimental CHF values are used to fit the local mass-balance equation. Contact angles, permeability, bubble scale, and evaporation closure must be declared before a forward comparison.",
  "acceptance_criteria": ["Dimensions of R are unity", "R(x) tends to one as x tends to zero", "0<R<1 has a unique x in (0,1)", "R>=1 is represented only as an explicit dry-spot-free extension"],
  "falsification_cases": ["Measured nonzero dry spot when independently measured R exceeds one", "Measured radial liquid flow that does not decline by cumulative evaporation", "Geometry intervention that changes the predicted R ordering but not measured CHF or dry-area behavior"],
  "uncertainty_plan": "Separate reported CHF uncertainty, source-digitization uncertainty, contact-angle uncertainty, property uncertainty, geometry tolerance, numerical root tolerance, and model-form discrepancy.",
  "benchmark_plan": ["Analytic limiting tests of R(x)", "MATLAB-to-Python regression for the 12 exported Figure 2 input rows; this is implementation parity only", "Source-audited literature records grouped by source, surface, coating, pressure, and laboratory; current compilation is fit-prohibited until all prediction inputs are directly supported"],
  "provenance": ["User-provided working manuscript and supplementary document", "Hu et al. 2019 IJHMT PDF supplied locally", "No unpublished numerical data are included in this package"]
}
