{
  "schema_version": "2.0",
  "title": "REPLACE_ME",
  "decision_or_claim": "REPLACE_ME",
  "model_status": "proposed",
  "claim_ladder_rung": 1,
  "evidence_state": "proposed",
  "event_definition": "REPLACE_ME",
  "system_boundary": "REPLACE_ME",
  "regime": {
    "description": "REPLACE_ME",
    "included": ["REPLACE_ME"],
    "excluded": ["REPLACE_ME"]
  },
  "geometry_and_frame": "REPLACE_ME",
  "materials_or_fluids": ["REPLACE_ME"],
  "operating_conditions": [
    {
      "name": "REPLACE_ME",
      "range": "REPLACE_ME",
      "unit": "REPLACE_ME",
      "property_state": "REPLACE_ME",
      "evidence_state": "unknown"
    }
  ],
  "initial_conditions": ["REPLACE_ME"],
  "boundary_conditions": ["REPLACE_ME"],
  "dependent_variables": [
    {
      "name": "REPLACE_ME",
      "symbol": "REPLACE_ME",
      "dimension": "REPLACE_ME",
      "unit": "REPLACE_ME",
      "sign_convention": "REPLACE_ME",
      "role": "REPLACE_ME",
      "property_state": "REPLACE_ME",
      "definition": "REPLACE_ME",
      "evidence_state": "proposed"
    }
  ],
  "governing_variables": [
    {
      "name": "REPLACE_ME",
      "symbol": "REPLACE_ME",
      "dimension": "REPLACE_ME",
      "unit": "REPLACE_ME",
      "sign_convention": "REPLACE_ME",
      "role": "REPLACE_ME",
      "property_state": "REPLACE_ME",
      "definition": "REPLACE_ME",
      "evidence_state": "unknown"
    }
  ],
  "conservation_laws": ["REPLACE_ME"],
  "source_and_sink_terms": ["REPLACE_ME"],
  "constitutive_closures": [
    {
      "id": "C1",
      "name": "REPLACE_ME",
      "relation": "REPLACE_ME",
      "status": "assumed",
      "provenance": "REPLACE_ME",
      "calibration_boundary": "REPLACE_ME",
      "evidence_state": "assumed"
    }
  ],
  "frame_and_invariance": "REPLACE_ME",
  "scale_analysis": {
    "reference_scales": ["REPLACE_ME"],
    "dimensionless_groups": ["REPLACE_ME"],
    "ordering_parameters": ["REPLACE_ME"],
    "expected_reduction_error": "REPLACE_ME"
  },
  "assumptions": ["REPLACE_ME"],
  "exclusions": ["REPLACE_ME"],
  "baselines": ["REPLACE_ME"],
  "calibration_boundary": "REPLACE_ME",
  "acceptance_criteria": ["REPLACE_ME"],
  "falsification_cases": ["REPLACE_ME"],
  "uncertainty_plan": "REPLACE_ME",
  "benchmark_plan": ["REPLACE_ME"],
  "provenance": ["REPLACE_ME"]
}
